{"$schema":"https://json-schema.org/draft/2020-12/schema","$id":"deterministic-evaluation.schema.json","title":"deterministic-evaluation","type":"object","additionalProperties":false,"required":["schema_version","packet_id","rules","promotion_blocked"],"properties":{"schema_version":{"const":"1.0"},"packet_id":{"type":"string"},"rules":{"type":"object"},"promotion_blocked":{"type":"boolean"}}}